text,category
"﻿काठमाडौं । चौधौं हिमालयन ह्वाइट वाटर च्यालेन्ज २०१५आगामी मंसिर ११ गतेखेअि शुरु हुने भएको छ । नेपाल एशोसिएसन अफ र्याफटिङ एजेनिसज (नारा) ले आयोजना गर्न लागेको सो प्रतिायोगितामा ५ सयभन्दा बढीको सहभागिता रहने आयोजकको दावी छ । प्रतियोगिता ३ दिनसम्म चल्ने छ । अष्ट्रेलिया, क्यानडा, अमेरिका, चीन, मलेसियालगायत २० भन्दा बढी राष्ट्रका प्रतियोगीहरुको सहभागिता रहने नाराका अध्यक्ष चन्द्रबहादुर दाहालको दावी छ । र्याफटिङ चितवनको फिस्लिङदेखि कुरिनटारसम्म सञ्चालन हुने बताइएको छ ।
भुकम्पपछिको नेपालको शाहसिक जलयात्रा सुरक्षित छ भन्ने सन्देश दिने उद्देश्यका साथ प्रतियोगिता आयोजना गर्न लागिकएको दाहालले बताए । ‘ हामीले प्रवद्धर्नात्मक रुपमा हरेक बर्ष प्रतियोगिता सञ्चालन गरिरहेका छौं,’ उनले भने, ‘यसपटक भने जलयात्राका लागि खुल्ला १६ ओटै नदीमा सकुसल र सुरक्षित जलयात्राको सन्देश दिने उद्देश्य हो ।’
प्रतियोगिता अन्तर्गत कायाक स्लालोम कम्पिटिशन, कायाक बोटर क्रस कम्पिटीशन र कायाक फ्रिस्टायल कम्पिटिनन रहने छन् । जसमा सिनियर, जुनियर तथा महिलाको छुट्टाछुट्टै प्रतियोगिता हुने छ । प्रतियोगितामा कायाक स्लालोम,कायाक फ्रिस्टाइल तथा कायाक बोटर क्रमस अन्तर्गत प्रथम, द्धितिय र तृतियलाई क्रमशः १ लाख, ६५ हजार र ३५ हजार दिइने आयोजकले जानकारी दिएको छ ।
प्रतियोगितामा सहभागी हुनका लागि विदेशी प्रतियोगीले ४५ डलर र नेपालीले २ हजार ५ सय तिर्नुपर्ने छ । सहभागीका लागि आयोजकले यातायात, खाना तथा बस्नको व्यवस्था मिलाउने जानकारी दिएको छ । प्रतियोगीतामा २५ लाख भन्दा बढी खर्च हुने अनुमान आयोजकको छ ।
नाराका अनुसार विश्वका र्फटिङका लागि उत्कृष्ट १० नदिहरुमा नेपालको भोटेकोशी, कर्णाली र सुनकोशी पर्छन् ।
",tourism
"﻿५ पुस, काठमाडौं । नगरकोटस्थित क्लब हिमालयले क्रिसमस तथा अंग्रेजी नयाँ वर्षलाई स्वागत गर्ने उद्देश्यले जोडीका लागि विशेष प्याकेज ल्याएको छ ।
आगामी बिहीवार आयोजन गरिने कार्यक्रममा पाहुनालाई एकोमोडेशन सहित कक्टेल, स्न्याक्स, स्पेसल टर्की डिनर खुवाइने छ । साथै, शुक्रबार नयाँ बिहानीको ब्रेकफाष्टको प्याकेज समेत उपलब्ध छ ।
काठमाडौं उपत्यकाभन्दा केही पर बादलमाथिको गाउँमा रमाउने जोडीहरुको चाहान चाहना पुरा गर्न क्लब हिमालयले यस्तो कार्यक्रम ल्याएको हो । यो जोडीको लागि विषेश प्याकेजको व्यवस्था गरेको छ ।
क्लब हिमालयकी डाइरेक्टर परमिता शाक्यले क्रिसमस ईभ तथा न्यु इयरको विशेष प्याकेजमा रमाउन, आनन्दित हुन र त्यसलाई यादगर बनाउन चाहने समस्त जोडीहरुलाई स्वागत गर्न आतुर रहेको बताइन ।",tourism
"९ साउन, पोखरा । ऐतिहासिक, पुरातात्विक एवम् धार्मिक महत्व बोकेको पोखराको छोरेपाटनस्थित प्राकृतिक पुलमुनि गुफाबाट देखिने चाँदी जस्तै मनोरम झरना यतिखेर आन्तरिक एवम् बाह्य पर्यटकको आकर्षण बनेको छ । विश्वको एक मात्र राजमार्गमा रहेको प्राकृतिक पुलको उत्तरपट्टि डेभिजफल र दक्षिणी भागमा गुप्तेश्वर महादेव गुफा अचम्मको संगम भएको कारण यस ठाउँमा पर्यकटको आकर्षक बढेको हो । गुप्तेश्वर गुफाबाट लगभग दुई सय मिटरभित्र पसेपछि सिद्धार्थ राजमार्ग छेउमा प्राकृतिक पुलमुनिबाट झण्डै ६० मिटर भन्दा बढी गहिरो मनोरम पातले छागो(डेभिजफल) को स्पष्ट दृश्यावलोकन गर्न सकिन्छ ।
मनोरम पातले छाँगो (डेभिजफल) र गुप्तेश्वर महादेव गुफाको भरपूर उपयोग गरी महत्वपूर्ण पर्यटकीय स्थलको रुपमा विकास गरिए पनि बीच भागमा अवस्थित राजमार्गको प्राकृतिक पुलले भने अहिलेसम्म चर्चा पाउन सकेको छैन ।
पातले छाँगा (डेभिजफल) बाट झरेको पानीको बहावले तल्लो भागको जमिनलाई काटेर निकास बनाएपछि माथिल्लो भागले पुलको आकार लिएको हुन सक्ने भुगोलविद् प्रा डा कृष्ण केसीको बताउँछन् ।
“अन्नपूर्ण र माछापुच्छे्र« हिम श्रृङ्खलाको आसपासमा रहेका हिमतालहरु फुट्दा आएको भीषण वाढीको कारण पोखरा उपत्यकाको उत्पत्ति भएको हो,” उनले भने – “त्यही समयमा नै डेभिजफल, गुफा र उक्त पुलसँगै बनेको हुनुपर्छ ।”
माथिल्लाको भागमा सानो धाँजा फाटेको स्थानबाट मानिसहरु फड्केर वारिपारि गर्ने गरेकाले सो स्थानलाई त्यसै समयदेखि फड्के नामकरण गरिएको गुफा व्यवस्थापन समितिका अध्यक्ष विष्णुप्रसाद पौडेल बताउँछन् ।
सिद्धार्थ राजमार्ग निर्माणका क्रममा सो स्थानलाई ढुङ्गा र माटोले पुरेपछि यातायातको सुविधा पुगेको बताउँदै उनले भने– “सिमेन्टको पुलबाट मात्र हैन प्रकृति निर्मित पुलबाट पनि मानव निर्मित यातायातका साधन निर्वाध गुड्न सक्दछन् भन्ने यो ज्वलन्त उदाहरण हो ।”
गुप्तेश्वर महादेव गुफाबाट भित्र पसेपछि सुरुमा शेषनाग सहितको भगवान् शिवको सालिक देखापर्छ । त्यस स्थानबाटभित्र साँघुरो गुफाबाट पसेपछि प्राकृतिक पुलमुनि फराकिलो भाग रहेको ठाउँ छ जहाँबाट मनमोहक झरना देखिन्छ ।
सो स्थानसम्म पुग्न गुफा व्यवस्थापन समितिले सुविधा सम्पन्न बाटो र विद्युत्को समेत व्यवस्था गरेको छ भने प्रति टिकट एक सय रुपैयाँ लिने गरेको छ ।
गुफाको आम्दानीबाट समितिले विभिन्न सामाजिक विकास निर्माणका साथै गुप्तेश्वर महादेव बहुमुखी क्याम्पस सञ्चालन गर्दै आएको छ ।
प्राकृतिक पुलको माथिल्लो भागमा छोरेपाटन उच्च माविद्वारा व्यापारिक दृष्टिकोणले निर्माण गरिएका ३७ वटा पसल कवलको भाडा र पातले छाँगोमा प्रवेश गर्ने आन्तरिक एवम् वाह्य पर्यटकले तिर्ने शुल्कबाट वार्षिक ७० लाख रुपैयाँ भन्दा बढी आम्दानी हुने गरेको विद्यालय व्यवस्थापन समितिका अध्यक्ष टिकाराम पौडेल बताउँन् ।
फेवातालबाट वर्षाका समयमा आउने पानीको ठूलो बहावले जमिनको भित्री भाग खोलेर भू–बनोट कमजोर बनाएकाले सो क्षेत्रमा उचित ढल निकासका साथै आसपासमा भौतिक संरचना निर्माणमा सम्बन्धित निकायले बेलैमा सोच्न आवश्यक रहेको छ ।
पर्यटकीय स्थलको दोहन मात्र नभई त्यसको संरक्षण, सम्बद्र्धन र विकासमा जोड दिइनुपर्ने र तीनवटै प्राकृतिक श्रोतलाई एक साथ विकास गरिनु पर्ने यस क्षेत्रका विज्ञहरुको धारणा रहेको छ ।
",tourism
"११ साउन, काठमाडौं । सरकारले आगामी दश वर्षभित्र नेपालमा २५ लाख २२ हजार पर्यटक भित्राउने योजना बनाएको छ । यो अवधिमा पर्यटनबाट हुने आम्दानी साढे ३ खर्ब बढी पुराउने लक्ष्य राखिएको छ । पर्यटन मन्त्रालयले बनाएको दश वर्षे राष्ट्रिय पर्यटन रणनीतिक योजना २०१६–२०२५ मा यस्तो लक्ष्य राखिएको हो । अहिले नेपालमा ८ लाखको हाराहारीमा पर्यटक आउने गरेका छन् । पर्यटन क्षेत्रबाट झण्डै आधा खर्ब आम्दानी हुने गरेको छ । पर्यटन रणनीतिक योजना असार ३१ गते मन्त्रिपरिषदको पूर्वाधार विकास समितिले स्वीकृत गरिसकेको छ । पर्यटकीय मुलुक नेपालमा रणनीतिक योजना बनाएरै पर्यटन क्षेत्रको विकासमा सरकार तातेको हो ।
पर्यटन मन्त्रालयले महत्वाकांक्षी १० वर्षे रणनीतिक योजना दुई चरणमा पुरा गर्ने भएको छ । रणनीतिको पहिलो चरणभित्र (२०१६–२०२०) मा पर्यटकको संख्या १३ लाख ३९ हजार पुराउने लक्ष्य राखिएको छ । पर्यटकको औषत बसाई अवधि सन् २०२० मा १४ दिन पुराइने छ ।
सन् २० सम्ममा पर्यटकबाट हुने आम्दानी १ अर्ब ३२१ मिलियन अमेरिकी डलर पुराउने लक्ष्य छ । यस अवधिमा मुलुकको कुल ग्राहस्थ उत्पादन (जीडीपी)मा पर्यटन क्षेत्रको योगदान ४.९४ प्रतिशत पुग्ने रणनीतिमा उल्लेख छ ।
यसैगरी दोस्रो चरण २०२१ देखि २०२५ सम्मको हुनेछ । रणनीतिक योजनामा २०२५ सम्ममा पर्यटकको संख्या बढाएर २५ लाख २२ हजार पु¥याउने लक्ष्य राखिएको छ । पर्यटकको औषत बसाई अवधि १५ दिन पुराइने छ । त्यस्तै पर्यटन क्षेत्रबाट ३ अर्ब ४०१ मिलियन डलर आम्दानी गर्ने योजनामा उल्लेख छ । यस अवधिमा जीडीपीमा पर्यटन क्षेत्रको योगदान ९.२९ प्रतिशत पुग्ने अपेक्षा छ ।
यो रणनीतिक योजनामा पर्यटकको संख्या बढाउने, उनीहरुको बसाईं अवधि लम्बाउने, राजस्व र आम्दानीमा वृद्धि गर्ने, रोजगारी बढाउने लगायतलाई प्राथमिकतामा राखिएको छ । वार्षिक पर्यटक आगमन २०२० मा १७.५  र २०२५ मा १२.५ वृद्धि हुने अपेक्षा गरिएको छ ।
२०१५ को भूकम्पपश्चात पर्यटक आगमन झण्डै ३२ प्रतिशत घटेकोले यसको दीर्घकालिन असर पर्ने देखिन्छ । २०१७ मा पर्यटक आगमन २०१४ को स्थितिमा पुनरावृत्ति हुनसक्ने भएकाले २०१६ र २०१७ मा २५ र २० प्रतिशतको वृद्धिदर हासिल हुने अनुमान छ । बाँकी वर्षमा पनि १२.५ देखि १७.५ प्रतिशत सम्मको वृद्धि अनुमान गरिएको छ ।
यो रणनीतिको पहिलो चरणमा गन्तव्य विविधीकरण र सुधारमा जोड दिइने छ । दोस्रो चरणमा नयाँ उत्पादनहरूलाई एकीकृत गर्नमा जोड दिइने भएको छ । त्यस्तै, चरण १ मा विकास गरिएका उच्च मूल्य बजार (पर्यटक) हरूलाई लक्षित गर्दै नयाँ ठाउँहरू खोलिने छ र पर्यटकीय उत्पादनका सम्भावनाहरूलाई विस्तार गरिने छ ।",tourism
"१२ साउन, काठमाडौं । सरकारले भाडा निर्धारण नगर्दा केबलकार सञ्चालकले मनपरी भाडा उठाउने गरेका छन् ।  विसं २०५४ मङ्सिर ८ गतेदेखि नेपालमा केबलकार सञ्चालनमा आए पनि अहिलेसम्म सार्वजनिक यातायातको भाडा निर्धारण गर्ने जिम्मा पाएको यातायात व्यवस्था विभागले भाडा निर्धारण गरेको छैन ।
विसं २०५३ कात्तिक २२ गते कम्पनी रजिष्ट्रारको कार्यालय र उद्योग विभागमा दर्ता गरी चितवनको कुरिनटारदेखि गोरखाको मनकामनासम्म ३.२ किमी दूरीमा केबलकार चलाइएको थियो । केबलकारलाई सवारी तथा यातायात व्यवस्था ऐन २०४९ मा यातायातका रुपमा उल्लेख नगरिएकाले अहिलेसम्म विभागले भाडा निर्धारण नगरेको महानिर्देशक चन्द्रमान श्रेष्ठले जानकारी दिए ।  “केबलकारलाई व्यवस्थित गर्न भौतिक पूर्वाधार तथा यातायात मन्त्रालयले कार्यविधि ल्याउने गृहकार्य गरेको छ, कार्यविधि जारी भएपछि व्यवस्था भएअनुसार भाडा निर्धारण गरिनेछ,” उनले भने ।
हाल मुलुकमा दुईवटा ठाउँमा केबलकार सञ्चालनमा छन् भने दर्जन बढीठाउँमा सञ्चालनका स्वीकृति लिई निर्माणको प्रक्रियाका लागि यातायात मन्त्रालयमा निवेदन दर्ता गराएका छन् । पहिलो मनकामना केबलकारका नायब महाप्रबन्धक वीरेन्द्र श्रेष्ठ कम्पनीकै तर्फबाट भाडा निर्धारण गरी लिने गरेको स्वीकार्छन् ।
“साउनदेखि कुरिनटारबाट मनकामनासम्म दुईतर्फी ६४० र एकतर्फी  ३८५ रूपैयाँ भाडा निर्धारण गरिएको छ, यसअघि दुईतर्फी ५७५ र एकतर्फी ३४५ रूपैयाँ लिइन्थ्यो, भाडा निर्धारणका लागि यातायात व्यवस्था विभागसँग कुनै सम्बन्ध राखिएको छैन,” उनले भने। मनकामना केबलकारमा वार्षिक १० लाख यात्रुले यात्रा गर्ने गरेको कम्पनीले जनाएको छ । कम्पनीले उठाएको भाडाको एक÷एक प्रतिशत चितवन र गोरखा जिल्ला विकास समितिलाई बुझाइन्छ ।
केबलकार चढेर मनकामना दर्शन गर्न जाने यात्रु भने लगानी र खर्चका आधारमा कम्पनीले बढी नै भाडा उठाएको गुनासो गर्दै आएका छन् । केबलकार कुन सरकारी निकायले नियमन गर्ने भन्ने अन्योल रहेका कारण सरकारीस्तरबाट उपयुक्त भाडा निर्धारण नभएको यात्रु अरुण पौडेलको गुनासो छ । सञ्चालनको कार्यविधिको यातायात मन्त्रालयलाई जिम्मेवारी दिइएको छ ।
सो जिम्मेवारीसँगै यसअघि पर्यटन विभागले केबलकार स्वीकृतिका लागि गरेको कामको स्वामित्व यातायात मन्त्रालयमै हस्तान्तरण भएको प्रवक्ता देवेन्द्र कार्कीले बताए। विसं २०७३ वैशाख १ गतेदेखि चन्द्रागिरि हिल्स लिमिटेडले थानकोट गोदामदेखि चन्द्रागिरिडाँडासम्म २.५ किमी दूरीमा केबलकार परीक्षण सुरु गरेको छ ।
लिमिटेडले सरकारी निकायसँग भाडा निर्धारण गराएर मात्र सार्वजनिक रुपमा यात्रुका लागि खुला गर्ने तयारी गरेको कार्यकारी बिक्रेता इन्दिरा पौडेलले बताए। मन्त्रालयका सहसचिव विष्णुओम वादेले कार्यविधि आएपछि केबलकारको भाडा निर्धारणको काम यातायात व्यवस्था विभागले गर्ने गरी व्यवस्था गर्न लागिएको बताए।
",tourism
