text,category
"﻿६ भदौ भीमदत्तनगर । विश्वकै दुर्लभ दुई हजार ३०० को झुण्डमा देख्न पाइने बाह्रसिङ्गा, नेपालको सबैभन्दा ठूलो ५५ वर्गकिलोमिटरमा फैलिएको विशाल घाँसे मैदान । जैविक विविधता, बाघ, गैँडा, हात्ती, चित्तललगायतका वन्यजन्तु र सयौँ प्रजातिका चराचुरुङ्गीले भरिपूर्ण कञ्चनपुरको शुक्लाफाँटा वन्यजन्तु आरक्ष पर्यटकीय दृष्टिकोणले महत्वपुर्ण गन्तव्यस्थल हो ।
तर यहाँ अवलोकन गर्न आउने बाह्य तथा आन्तरिक पर्यटकको स¬ङख््या भने निरासाकै स्थितिमा छ । सरकारी तवरबाट शुक्लाफाँटा वन्यजन्तु आरक्ष कार्यालयले त्यसको प्रचारप्रसार र पर्यटकको आगमनमा स्वागतका लागि आतुर रहे पनि यहाँको निजी क्षेत्रले भने पर्यटनको विकासमा संस्थागत रुपमा कुनै कदम चालेको देखिँदैन ।
पछिल्ला आधा दशकयता होटल व्यवसायबाट पर्यटन व्यवसायमा आएका भीमदत्तनगरका पर्यटन व्यवसायी परमानन्द भण्डारीले भने एक्लो प्रयासमा यहाँका पर्यटकीय गन्तव्य चिनाउन ठुलो प्रयास जारी राखेका छन् ।
“शुक्लाफाँटाको प्रचारप्रसार नै भएन ।” पर्यटन व्यवसायी भण्डारीले भने– “राज्यसँगै यहाँको निजीक्षेत्र पनि पर्यटनको विकासमा जाग्नु आवश्यक छ ।” यहाँका पर्यटकीय स्थल शुक्लाफाँटा, महाकाली नदीको झोलुङ्गे पुल, बेदकोट ताल र झिलमिला तालमा पर्यटक भित्र्याउन सके सबै क्षेत्रलाई टेवा पुग्ने उनको बुझाइ छ ।
“पर्यटक आए भने यहाँको व्यापार व्यवसायमा पनि फाइदा पुग्छ ।” उनले भने – “सुदूरपश्चिमको पर्यटकीय सम्भावनालाई शब्दमा वर्णन गर्न कठिन छ ।”
व्यवसायी भण्डारी शुक्लाफाँटालाई खप्तड, बडीमालिका, रारालगायतका अन्य पर्यटकीय रुपले चल्तीका स्थलसँग जोडिरहेका छन् । “पर्यटकमाझ शुक्लाफाँटाको प्रचारप्रसारका लागि भन्दै विभिन्न टुर प्याकेज ल्याइरहेको छु ।” उनले भने –“यात्रा सञ्चालन गरेयता शुक्लाफाँटामा ५०० भन्दा बढी पर्यटक वृद्धि भए ।”
२०७२ साल फागुन ६ गतेदेखि शुक्लाफाँटा भ्रमण प्याकेज ल्याएका भण्डारीले हालै शुक्लाफाँटादेखि बाजुराको धार्मिक पर्यटनको गन्तव्य बडीमालिकासम्मको प्याकेज सुरु गरेका छन् ।
एक हप्ता लामो उक्त प्याकेजमा २२ जना आन्तरिक पर्यटक खप्तड भ्रमणमा निस्केकको उनले बताए ।
त्यसैगरी गत जेठ ३० देखि असार ४ गतेसम्म छ जना पर्यटकसँगै शुक्लाफाँटा–रारा भ्रमण गरेका भण्डारीले गत असार ३० गतेदेखि साउन ४ गतेसम्म ११ जनाको टिम लिएर बडीमालिकाको यात्रा सकेका छन् ।
“सबै पर्यटकीय स्थललाई शुक्लाफाँटा जोड्दै छु ।” भण्डारीले भने – “लगत्तै शुक्लाफाँटादेखि दार्चुलाको अपी हिमालसम्मको यात्रा तय गर्दैछु ।”
“यस प्रकारका टुर प्याकेजले तराईदेखि हिमालसम्म घुम्न जाने पर्यटकलाई सुलभ हुन्छ ।” उनले भने–“सुदूरपश्चिमको पर्यटन विकासका लागि भारतीय पर्यटन व्यवसायीसँग पनि समन्वय गरिने छ ।”
भारतको नैनीताल, देहरादुनलगायतका केही पर्यटकीय क्षेत्रका पर्यटन व्यवसायीसँग पनि पर्यटक दुवै क्षेत्रमा भ्रमण गराउने विषयमा पनि समन्वय भइरहेको उनको भनाइ छ । कञ्चनपुरमा भण्डारी एक्ला पर्यटन व्यवसायी पनि हुन ।
शुक्लाफाँटा वन्यजन्तु आरक्ष कार्यालय प्रमुख संरक्षण अधिकृत बेदकुमार ढकालले पर्यटन व्यवसायी भण्डारीको शुक्लाफाँटादेखि अन्य क्षेत्रको टुर प्याकेजले शुक्लाफाँटालाई सहयोग पुगेको बताए।
त्यसका साथै शुक्लाफाँटा छेउमै गत वर्षदेखि सञ्चालनमा आएको राना थारु होमस्टेका कारण पनि शुक्लाफाँटामा पर्यटक आउने क्रम बढेको प्रमुख संरक्षण अधिकृत ढकालले जानकारी दिए।
शुक्लाफाँटा वन्यजन्तु आरक्ष कार्यालयले दिएको जानकारी अनुसार गत आवमा शुक्लाफाँटामा आन्तरिक र बाह्य गरी एक हजार ९०० पर्यटकले अवलोकन गरेका छन् ।
नेपाल–भारतको पश्चिम सीनाकामा सहज आवागमन र भीमदत्त नगरपालिकामा बन्द अवस्थामा रहेको विमानस्थल सञ्चालनमा आउन सके पर्यटकीय दृष्टिकोणबाट पनि सुदूरपश्चिमलाई सहज हुने पर्यटन व्यवसायीको भनाइ छ ।
",tourism
"﻿काठमाडौं । चन्द्रागिरी डाडाँमा केवलकार संचालनमा आएसँगै पाँचचारे होटल निर्माण पनि तिब्र गतिमा अघि बढेको छ । एक बर्षभित्र सञ्चालनमा ल्याइसक्ने गरी चन्द्रागिरी हिल्स लिमिटेडले होटलको निर्माण गरिरहेको छ । बुटिक होटलको अवधारणा अनुसार निर्माणको काम भइरहेको चन्द्रागिरी हिल्सका अध्यक्ष चन्द्रप्रसाद ढकालले बिजखबरलाई बताए । ‘यो नेपालकै नमुना होटल बन्नेछ’ उनले भने ।
विदेशी पर्यटकलाई लक्षित गरी निर्माण गरिएको होटलमा एक सय बेडरुम हुेनछन् । होटलको बाहिरी बनावटदेखि भित्री भागसमेत ऐतिहासिक झझल्को दिने गरि तयार गर्ने योजना बनाइएको छ । काष्ठकलाको प्रयोगहुने होटलमा बाहिर मन्दिरमा जस्तै टुडाल र भित्रीभागमा तत्कालिन समयका चित्र कुदिएका हुनेछन् । जुन होटलको मुख्य आकर्षण बन्ने निर्माण कम्पनीको भनाइ छ ।
होटललाई सकभर छिटो संचालनमा ल्याउने गरी निर्माणकार्य अघि बढाइएको चन्द्रगिरी हिल्स लिमिटेडका सेल्स एण्ड मार्केटिङ म्यानेजर बिख्यातविक्रम राणा बताउछन् । ‘ऐतिहासिक महत्व बोकेको चन्द्रगिरी डाँडामा होटल पनि ऐतिहासिक नै बन्नेछ,’ उनले भने, ‘जसले विदेशी तथा स्वदेशी पर्यटकलाई आकर्षित गर्ने छ ।’

गोरखा दरबारको डिजाइनमा होटल
चन्द्रगिरी हिल्सले होटललाई गोरखा दरवारको डिजाइनमा बनाउने बताएको छ । सो स्थान र राजा पृथ्वीनारायण शाहबीच ऐतिहासिक महत्व जोडिएका कारण होटल पनि गोरखा दरबारकै डिजाइन बनाउन लागिएको राणा बताउँछन् । ‘तत्कालिक समयमा गोरखाका राजा पृथ्वीनारायण शाहले सोही स्थानबाट काठमाडौं माथी आँखालगाइ विजय प्राप्त गरेका कारण सो स्थानमा उनकै दरवरजस्तो होटल निर्माण गर्न लागिएको हो । साथै, सो होटल बुटिक खालको हुनुका साथै ऐतिहासिक महत्व समेत बोक्ने राणाको दावी छ ।
१ अर्ब २५ करोड लागत
होटल निर्माणको खर्च १ अर्ब २५ करोड रुपैयाँ अनुमान गरिएको छ । चन्द्रगिरी हिल्सले यसै स्थान आसपासमा ३ अर्ब ५० करोडको लागतमा मेगा प्रोजक्ट बनाइरहेकोमा होटल निर्माणका लागि मात्र सो रकम खर्च हुने भएको छ । चन्द्रागिरी हिल्सले सो स्थानमा केवलकार, भ्यू टावर, रेष्टुराँ, फनपार्क, सेमिनार हलनिर्माण सम्पन्न गरिसकेको छ ।
होटलसम्म गल्फकार्ड र केवलकार
होटलमा गल्फकार्ड र केवलकारबाट पुग्न सकिने छ । होटलमा थानकोटबाट केवलकार वा गल्फकार्ड (बग्गी जस्तो विद्युतिय गाडी)बाट पुग्न सकिने छ । अहिले त्यहाँ पुग्न केवलकारको प्रयोग भइरहेकोमा होटल संचालनमा आएसँगै गल्फकार्ड समेत संचालनमा ल्याइने राणाले जानकारी दिए । सो स्थानमा माथीबाट केवलकार र स्थलमार्ग हुँदै गल्फकार्डबाट पुग्न सकिन्छ ।
",tourism
"﻿काठमाडौं । २०१६ मा पर्यटक संख्यामा बृद्धि भएको छ । सो समयाअविधमा अध्यमगमन विभागका अनुसार २०१६ को पहिलो ६ महिनामा ३ लाख १३ हजार ५ सय ५२ पर्यटक भित्रिएका छन्  यो अघिल्लो बर्षको सोहीअवधिकोतुलनामातुलनामा १६ प्रतिशतले बढी हो । २०१५ को पहिलो ६ महिनामा २ लाख ७७ हजार ९ सय ५२ जना पर्यटक भित्रिएका थिए ।
तथ्यांक अनुसार यस बर्ष ५४ हजार २ सय २४ भारतीय पर्यटकले नेपाल भ्रमण गरेका छन् । अघिल्लो बर्षको ६ महिनामा ३९ हजार ४ सय भारतीय पर्यटकले नेपाल भ्रमण गरेका थिए । नेपालमा भारतीय पर्यटक सवैभन्दा बढी आउँछन् ।
नेपाल भित्रिनेमा दोश्रो स्थान रहेका चिनियाँ पर्यटक भने अघिल्लो बर्षको सो अवधिको तुलनामा २८ प्रतिशतले कम हो । यता पछिल्लो ६ महिनामा नेपाल भित्रने पर्यटक संख्याको बृद्धिद्धरमा अमेरिका सबैभन्दा अगाडी छ ।
१९ हजार ४ सय ४५ जना अमेरिकी पर्यटकले भ्रमण गरेका थिए । यस बर्षको ६ महिनामा सो संख्या ४७ दशमलव ४० अंकले बढेको छ । अहिले २८ हजार ६ सय ७६ पुगेको छ ।
नेपाल भित्रने धेरै पर्यटकमा अमेरिका सूचीको तेस्रो स्थानमा छ ।
वेलायत, श्रीलंका, थाइल्याण्ड, म्यानमार, दक्षिण कोरिया, जर्मनी र जापान क्रमशः सूचीको चौथोदेखि दशैं स्थानमा छन् ।
",tourism
"﻿१० भदौ, तनहुँ । बन्दीपुर नगरपालिका कार्यालयले बन्दीपुर क्षेत्रभित्र र बाहिरको करिब ५०० मिटर क्षेत्रलाई संरक्षित उपक्षेत्रका रुपमा घोषणा गरेको छ ।पर्यटकीय नगरी बन्दीपुरमा घर निर्माण गर्दा पश्चिमेली शैली झल्किने वस्तु प्रयोग गर्न नपाइने र पुराना शैलीका घरलाई संरक्षण गर्ने उद्देश्यले उक्त क्षेत्रलाई संरक्षित उपक्षेत्रका रुपमा घोषणा गरिएको हो ।
उक्त क्षेत्रमा घर बनाउँदा बस्ती विकास सहरी योजना तथा भवन निर्माणसम्बन्धी आधारभूत मापदण्ड र नगरपालिकाले बनाएको नियम पालना गर्नुपर्ने व्यवस्था रहेको कार्यकारी अधिकृत लेखनाथ न्यौपानेले बताए।
बन्दीपुर बजार क्षेत्रमा पुरानो शैलीका घर पर्यटकको आर्कषणको केन्द्रबिन्दु रहेकाले उपक्षेत्रभित्र घर निर्माण गर्दा आधुनिक र पश्चिमेली शैलीका घर निर्माण गर्न नपाइने उनले जानकारी दिए ।
उक्त क्षेत्रमा भएका पुराना संरचनाका घर भत्काउन समेत स्थानीय निकायको स्वीकृति लिनुपर्ने छ । घर निर्माण गर्दाका हकमा भने पराम्परागत नेपाली शैली एवम् आकार प्रकारका काठका झ्यालढोका राख्नुपर्ने, बार्दली कोठा निकाल्न नपाइने, बाहिरी गारामा प्लास्टर नगरी प्रस्टसँग इँटा देखाउनुपर्ने प्रावधान छ ।
त्यसैगरी कला, वास्तुकला एवम् धार्मिक दृष्टिकोणले महत्वपूर्ण रहेको ठाउँमा स्मारक वा स्मारकको परिसर वरिपरिका पहिलो पङ्क्तिमा घर स्मारकभन्दा होचो हुने गरी निर्माण गर्नुपर्ने लगायत नियम रहेको नगरपालिकाले जनाएको छ ।
",tourism
"﻿काठमाडौं । नेपाल पर्यटन बोर्डका नवनियुक्त कार्यकारी अधिकृत दिपकराज जोशीले बुधवार पदभार ग्रहण गरेका छन् । पर्यटन बोर्डमा आयोजित एक कार्यक्रमवीच पदभार ग्रहण गरेका हुन् । सो अवसरमा उनले पदसँगै आफ्नो उत्तरदायित्व थप भएको बताए ।
साथै सो उत्तरदायित्व आफु एक्लैले गर्न असम्भव भएकोले सवैलाई साथ दिन आग्रह गरे । ‘ पर्यटन क्षेत्र जटिल अवस्थामा पुगेकोले गर्नुपर्ने धेरै छ’ उनले भने ‘सवैको साथ पाए असम्भव केही छैन ।’
भुकम्प तथा नाकाबन्दीले धरासयी बनेको पर्यटन क्षेत्रलाई उकास्नु आफ्नो पहिलो चुनौती रहेको उनले जानकारी दिए । त्यस्तै ‘एग्रेसिभ मार्केटिङ प्रमोसन’ नगरि धरासयी बनेको पर्यटनलाई उकास्न नसकिने दावी गरे । जोशीका अनुसार बार्षिक ८ लाख पर्यटक आउने गरेकोमा यस बर्ष २ लाख मात्र पुग्ने बताए । साथै पहिलो बर्षलाई सर्भाइभल इयरका रुपमा लिएकोले त्यस अनुसार योजना बनाउने जानकारी दिए । कार्यक्रममा उनले उनले नीजि क्षेत्र विना पर्यटन बोर्डको प्रगती सम्भव नभएको बताए । त्यस्तै कहिलेकाँही काम गर्न नदिने पक्ष हावी हुने हुँदा त्यस्ते अवस्थामा सवैको साथ चाहिने बताए ।
जोशीले पर्यटनलाई गाउँ गाउँ पुर्याउन माग आइरहेपनि त्यो सम्भव नभएको स्पष्ट पारे । ‘पर्यटन एउटा व्यवसाय भएकोले यसलाई गाउँगाँउ पुर्याउन सकिदैन’ उनले भने ‘पर्यटनको आम्दानीलाई गाउँगाउा पुर्याउन चै सकिन्छ ।’ आफ्नो सिदान्त कम बोल्ने र धेरै गर्ने भएको बताए ।
सो अवसरमा अध्यागमन विभागका प्रमुख केदार न्यौपानेले सिइयो ४ बर्ष नहुँदा रोकिएका कामलाई नयाँ कार्यकारी अधिकृत पुरा गर्नुपर्ने बताए । त्यस्तै बोर्डको बैठक बोलाएर भोलि देखिनै क्षेत्रगत योजना बनाएर अगाडी बढ्न सुझाव दिए । सो अवसरमा उनले नयाँ कार्यकारी निर्देशकलाई सरकारको पुरा समर्थ रहेको बताए । ‘योजना लिएर लयाउनुस हामी आखाँँ चिम्लेर पास गर्छौ’ उनले भने ।
कार्यक्रममा पाटाका महासचिव बसन्त मिश्र, टानका अध्यक्ष चन्द्रप्रसाद रिजाललगायतले नवनियुक्त कार्यकारी अधिकृतलाई बधाई दिएका थिए ।",tourism
