text,category
"﻿१९ साउन, इलाम । इलाम नगरपालिका–७ स्थित महभिरमा रक क्लाइम्बिङका लागि संरचना निर्माण गरिएको छ । मेची पहाडी क्षेत्र पर्यटन प्रवद्र्धन विकास समितिको आर्थिक सहयोग, नेपाली सेनाको कालीध्वज गणको प्राविधिक तथा जनशक्ति सहयोग तथा स्थानीय प्रगति युवा समाजको पहलमा महभीरमा करिब ४० मिटर अग्लो पहरामा रक क्लाइम्बिङ स्थल निर्माण गरिएको हो । उक्त क्षेत्रमा रक क्लाइम्बिङ, रक गार्डेन र बाल उद्यान निर्माण गर्ने योजनाअनुरूप पहिलो चरणमा रक क्लाइम्बिङ निर्माण गरिएको मेची पहाडी क्षेत्र पर्यटन प्रवद्र्धन विकास समितिका कार्यकारी निर्देशक केशव द्यौरालीले बताए । समितिको १० लाख रूपैयाँ र स्थानीय क्लब, उपभोक्ता समितिको रु चार लाखको लागतमा रक क्लाइम्बिङ निर्माण सम्पन्न गरिएको हो ।
उक्त रक क्लाइम्बिङमा नेपाली सेनाका खेमबहादुर डाँगी र भवानीशङ्कर थापाले ओपन तथा अस्ट्रेलियन रेप्लिङसमेत गरेका छन् । रक क्लाइम्बिङको योजना विगतका वर्षमा पनि बारम्बार उठ्ने गरेपनि निर्माण हुन सकेको थिएन । “रक क्लाइम्बिङ निर्माण गर्ने महाभिरवासीको धोको पूरा भएको छ”, अध्यक्ष उमेश महतले भने, “रक क्लाइम्बिङको प्रशिक्षणमा पठाएर दक्ष जनशक्ति तयार पार्ने योजनामा छौँ ।”
अहिलेको रक क्लाइम्बिङ क्षेत्रको नजिकै रहेको झर्नामा क्यानोनिङ पनि गर्न सकिन्छ भने ठूलो पहरामा झोलुङ्गे पुल बनाएर ओहोरदोहोर गर्नसके धेरै आन्तरिक तथा बाह्य पर्यटकलाई एउटा उत्तम गन्तव्य बनाउन सकिने द्यौरालीको भनाइ छ ।
कालीध्वज गणका प्रमुख सेनानी प्रकाश लामिछानेले रक क्लाइम्बिङका लागि विज्ञ जनशक्ति नेपाली सेनाबाट उपलब्ध गराईदिएबमोजिम निर्माण गर्न सहज भएको हो । सोही बमोजिम विज्ञ खेमबहादुर डाँगी, भवानीशङ्कर थापा तथा सेनाको थप मद्दतबाट ४५ दिन लगाएर पहराको लेउ, झार, घाँस र रूख सफा गरिएको हो ।
अब अझै त्यो पहरालाई पानीले धोएर सफा गर्नुपर्ने युवा समाजले जनाएको छ । केही समयपछि रक क्लाइम्बिङको औपचारिक उद्घाटन गरी सबैलाई बोलाएर रक क्लाइम्बिङ र रेप्लिङको प्रस्तुति गर्ने योजना रहेको कार्यकारी निर्देशक द्यौराली बताउँछन् ।
",tourism
"२१ साउन, बर्दिवास । साउने बोलबम मेला जारी नै रहेको बेला महोत्तरी जिल्लामा धार्मिक महत्वका पर्यटकीय स्थलको रुग्ण अवस्थाबारे चिन्ता बढेको छ ।साउने बोलबम मेलामा शिवालयमा चहलपहल बढिरहेकै बेला जिल्लाका बुद्धिजीवी र सर्वसाधारणले यहाँका शिवालय र अन्य धार्मिक महत्वका पर्यटकीय स्थल बेवास्ताको सिकार भएको टिप्पणी गरेका हुन् ।
जिल्लाको सुदूर उत्तरवत्र्ती क्षेत्रको चुरे फेदीस्थित बर्दिवास–१२ मा पर्ने प्रसिद्ध धार्मिकस्थल टुटेश्वर महादेव मन्दिर क्षेत्रमा खानेपानी, शौचालय र बसोबासका लागि धर्मशाला नहुँदा सो क्षेत्र फेहोरको डुङ्गुर बनेको छ । साउने मेलामा महिनैभरि श्रद्धालुको सघन चहलपहल हुने मन्दिर परिसरको विकासका लागि कुनै निकायले चासो नदेखाउँदा मन्दिरको अस्तित्व नै सङ्कटमा परेको बर्दिवास–१२ टुटेश्वर बस्तीकै सामाजिक कार्यकर्ता हरिबहादुर महतले बताए ।
बर्दिवास नगरकै वडा नम्बर ५ मा पर्ने राईमण्डल धार्मिक क्षेत्र पनि उपेक्षाको सिकार भएको छ । चुरे पर्वतका पाखामा प्राचीनकालमै कुँदिएका रामायण र महाभारतकालीन मूर्ति हेर्न र इन्द्रेश्वर महादेवको दर्शन गर्न श्रद्धालुको घुइँचो लाग्ने गरेपनि यो धार्मिक क्षेत्रको संरक्षण, संवद्र्धन र विकासमा समुदाय र सरकारी निकायले चासो नदेखाएका अन्तरपार्टी महिला सञ्जाल बर्दिवासकी अध्यक्ष शारदा थापाको गुनासो छ ।
“बर्दिवास नगरक्षेत्रमा प्रशस्त पर्यटकीय सम्भावनाका ठाउँ छन्”, थापाले भने “तर, तिनको विकास, संरक्षण र संवद्र्धनमा कतै कुनै निकायबाट चासो देखाइएको पाइँदैन ।”
बर्दिवास–१० स्थित पञ्चधुरा माईमन्दिर पनि समुचित सम्भार र संरक्षणको अभावमा मुस्किलले आफ्नो अस्तित्व धानिरहेको देखिँदो छ । जिल्लाकै भङ्गाहा–६ सिद्धपुरस्थित अति प्राचीन सिद्धनाथ महादेव मन्दिर त बडहरी नदीको बगरमाझ ठिङ्ग उभिएको छ । बर्सेनि साउन महिनाभरि र महाशिवरात्रि मेलामा ठेक्का बन्दोबस्तबाट हुने आम्दानी पनि मन्दिर संरक्षण र सम्भारमा नलगाइएको मन्दिर छेउकै पलार बस्तीका दलित अगुवा चौठी सर्दार बाँतरले दिक्दारिँदै बताए ।
नेपाल र भारतका श्रद्धालुको वर्षौंदेखि धार्मिक गन्तव्य रहँदै आएको सोनामाईको भोइलस्थित सोनामाईस्थान र पडौलस्थित कारिखस्थानमा चढौंना रकम (श्रद्धालुले चढाउने भेटी) का लागि समुदायका समूह÷समूहबीच रडाको हुने गरेको छ । मन्दिरको भेटी कज्याउन रडाको मच्चिँदै आएपनि यी प्राचीन धार्मिक धरोहरको विकासमा भने समुदाय, स्थानीय निकाय र अन्य सरकारी निकाय उदासीन देखिएका सर्वसाधारणले गुनासो गरेका छन् ।
जिल्ला सदरमुकाम जलेश्वरस्थित प्रसिद्ध धार्मिकस्थल जलेश्वरनाथ महादेव मन्दिर पुरानै गतिमा घस्रिरहेको छ । मैथिली भाषाका महाकवि कोकिल विद्यापतिको डिह (कार्यस्थल) मानिएको बनौली दनौलीस्थित विद्यापति गढका नाउँमा संस्था दर्ता गरेर विभिन्न निकायमा रकम माग गर्ने होड देखिएपनि डिहको संरक्षणमा भने आशातीत काम हुन नसकेको सोही बस्तीका युवा सामाजिक कार्यकर्ता नारायण झाले गुनासो गर्नुभयो ।
यसैबीच, बर्दिवास नगरपालिकाले नगर क्षेत्रका धार्मिकस्थल, पिकनिक स्पट (वनभोजस्थल) र प्राचीन धरोहरको समुचित विकास र संरक्षणका लागि विस्तृत कार्ययोजना बनाइरहेको जनाएको छ । नगरका यस्ता ठाउँको विकासमा स्थानीय समुदायलाई उत्प्रेरित गर्दै योजनाबद्ध कामको सुरुआत गरिसकिएको नगरका कार्यकारी अधिकृत रामकुमार कार्कीले जानकारी दिए ।
यसैगरी, जिविस महोत्तरीका स्थानीय विकास अधिकारी कृष्ण चापागाईंले जिल्लाका धार्मिक र पर्यटकीयस्थलको विकास र संरक्षणका लागि बृहत्तर जनकपुर क्षेत्र विकास कोष र अन्य निकायको समन्वयमा काम थालिने गरी गत जिल्ला परिषद्ले निर्णय गरेअनुसार प्रारम्भिक काम सुरु भएको बताए ।
पछिल्लो पटक सम्बन्धित स्थानीय निकायमा धार्मिक र पर्यटकीय क्षेत्रको पहिचान, सम्भाव्यता अध्ययन र संरक्षण संवद्र्धनका कुरा छलफलमा सुनिने गरिएपनि तिनका लागि स्रोत खोज्ने र रकम विनियोजन गर्ने काम नगरिएकाले केही काम हुने कुरामा विश्वास हुने आधार नदेखिएको बुद्धिजीवीले टिप्पणी गरेका छन् ।
जिल्लाका धार्मिकस्थल र राम्रो सम्भावना बोकेका पर्यटकीय स्थलको विकासमा ठ्याक्कै यो काम गरिने भनेर योजना बनाउने, स्रोतको खोजी गर्ने र रकमको व्यवस्थाबारे स्थानीय निकाय उदासीन रहेकाले काम हुने विश्वास जाग्न नसकेको जलेश्वर–१४ का बासिन्दा उपसचिव पदको सरकारी सेवाबाट अवकाश लिनुभएका संस्कृतिविद् महेश्वर रायको टिप्पणी छ ।
",tourism
"﻿काठमाडौं । पर्यटन मन्त्री आनन्द पोखरेलले पोखराको प्याराग्लाइडिङ उडाउने कम्पनीलाई अन्यत्र सार्दा  ३ बर्षसम्म कर दिने बताएका छन् । पोखरामा क्षेत्रीय विमानस्थल बन्ने भएकाले त्यहाँबाट विस्थापित भइ अन्यत्र व्यवसाय सञ्चालन गर्ने प्याराग्लाइडिङ कम्पनीलाई कर मिनाहा गर्ने बताएका हुन् ।
मंगलवार राजधानिमा आयोजित अन्तक्रिया कार्यक्रममा ३ बर्षभित्रै विमानस्थल बन्ने भएकोले त्यहाँको प्याराग्लाइडिङ विस्थापित हुने भएकोले यस्तो सुविधा दिन लागेको जानकारी दिए । ‘ सरकारले सम्भाव्यता अध्ययन गरेको क्षेत्रमा प्याराग्लाइडिङ सञ्चालन गरेको अवस्थामा मात्र यो लागु हुन्छ’ उनले भने ।
मन्त्री पोखरेलले प्याराग्लाइडिङ पर्यटनको आकर्षण भएकोले यसको प्रवद्र्धन आवशयक रहेको जानकारी दिए । त्यस्तै पोखरामा वयवसाय गर्न दिनहुँजसो प्याराग्लाइडिङ दर्ताका निवेदन आएको र त्यसको स्वीकृत नगरि पठाउनु परेको बताए । सो अवसरमा उनले बुद्धको क्षेत्र लुम्विनीलाई हड्ताल तथा संघर्षरहित बनाउन आग्रह गरे । लुम्विनी म्युजियम जस्तो भएकोले चलायमान बनाउन आग्रह गरे । त्यस्तै काठमाडौं उपत्यकालाई मिनी लुम्विनीको रुपमा विकास गर्नुपर्ने बताए ।
साथै नेपालमा धार्मिक तथा सास्कृतिक पर्यटनको प्रवद्र्धन आवश्यक भएको बताए । ‘साहसिक पर्यटन प्रवद्र्धन भइसक्यो अव सा.स्कृतिक पर्यटनको प्रवद्र्धन जरुरी छ’ उनले भने ।
सो अवसरमा मन्त्री पोखरेलले व्यवसायीहरुलाई काठमाडौंमा बसेर इको टुरिजमको गफ गरेर नहुने बताए । ‘इको टुरिजमको प्रवद्र्धन गर्न काठमाडौं बाहिर जानु पर्छ’ उनले भने ।
मन्त्री पोखरेलले देशको आर्थिक विकासका ललागि पर्यटन क्षेत्रको प्रवद्र्धन आवश्यक रहेको बताए ।
साथै यस बर्षभित्र ७ प्रदेशमा १ १ पर्यटनको डेस्टिनेशन क्षेत्र तोक्ने जानकारी दिए । त्यस्तै मोवाइल एक्लिकेशन बनाएर नेपालका पर्यटकीय क्षेत्रबारे विश्वलाई जानकारी दिने इच्छा रहेको उनले बताए ।
त्यस्तै पर्यटन क्षेत्रलाई इन्धन उपलब्ध गराउन प्रधानमन्त्री समक्ष आग्रह गर्ने बताए ।
सो अवसरमा उद्योग वाणिज्य महासंघका वरिष्ठ उपाध्यक्ष भवानी राणाले टुरिष्ट भिसा निःशुल्क गरी पर्यटन प्रवद्र्धन गर्न आग्रह गरिने । उनले भौगोलिक विकट तर प्राकृतिक सुन्दरताले भरिपूर्ण स्थानहरुमा एयरपोर्ट बनाउन आग्रह गरिने । त्यस्तै अन्तरराष्ट्रिय विमानस्थलको व्यवस्थापन गर्न सुझाव दिइन ्। सो अवसरमा राणाले नाकाबन्दीले ५ अर्व भन्दा बढीको क्षती भएको जानकारी दिइन् ।
कार्यक्रममा होटल एशोसियशन नेपालका महासचिव विनायक शाहले नाकाबन्दीले होटल व्यवसाय द्धन्द्धकालको अवस्थामा फर्किएको जानकारी दिए । ‘ पर्यटक नआउदा आम्दानी छैन उनले भने , मूल्य बृद्धिले खर्च भने बढेको छ ।
बुकिङ रद्द गर्दा नेपालबारे नकारात्मक समाचार जानेहुँदा व्यवसाय जसोतसो चलाउन परेको बताए ।
त्यस्तै पहिलै विभिन्न सेवा सुविधा सम्वन्धि कन्ट्रयाक गरेको हुँदा सो दिन नसकेको अवस्थमा क्षतीपूर्ती समेत दिनु पर्ने हुनाले आम्दानी भन्दा खर्च बढेको छ ।
अन्तक्रिर्यामा टानका वरिष्ठ उपाध्यक्ष तासी सेर्पाले विभिन्न देशले ट्राभल एड्भाइजरी जारी गर्दै नेपाल आउन रोकेको बताए । ",tourism
"﻿२२ साउन, पाल्पा । तानसेन–रानीमहल दरबार सडक खण्डमा एक महिनाअघि खसेको पहिरो नहटाइँदा रानीमहल पुग्ने पर्यटकले सास्ती पाएका छन् ।पहिराले सडक अवरुद्ध बनेपछि नेपालको ‘ताजमहल’ रानीमहलसम्म सवारीसाधन चल्न सकेका छैनन् । तानसेनको गोर्खेकोट–औल हुँदै रानीमहल र तानसेन–चापपानी–कल्लाबारी हुँदै रानीमहलसम्मको सडकमा पहिरो खसेको हो ।
पहिराले पैदल यात्रुलाई समेत यात्रामा कठिनाइ भएको छ । सवारी साधन सञ्चालन हुन नसक्दा सो भेगबाट उच्च शिक्षा अध्ययन गर्न जाने विद्यार्थी र सामान ढुवानी गर्न समस्या भएको स्थानीय बासिन्दा ताराबहादुर साठ्ठीघरले बताए ।
रानीमहलसम्म पुग्ने सडक निर्माणको काम भइरहेकाले पनि धेरै पहिरो खसेको हो । ढुङ्गासहित पहिरो र रुख खसेकाले पहिरो व्यवस्थापन गर्न समस्या भएको बताइएको छ । रानीमहलसम्म पुग्ने सडक समयमा नै मर्मत गर्न सकिए स्वदेशी तथा विदेशी पर्यटकलाई यात्रामा सहज हुने स्थानीय होटल व्यवसायी बताउँछन् ।
",tourism
